{
  "receipt_id": "11111111-1111-4111-8111-111111111111",
  "session_id": "22222222-2222-4222-8222-222222222222",
  "disclosed_at": "2026-10-06T14:02:11Z",
  "disclosure_text_version": "disclosure-v1",
  "candidate_ack": "clicked",
  "candidate_ack_at": "2026-10-06T14:02:19Z",
  "consent_record": true,
  "consent_pooling": false,
  "locale": "en-US",
  "jurisdiction_hints": ["US-IL"]
}
